number,name,date,event,location,reign,days,days recognised,notes
127,Dean Ambrose,"June 19, 2016",Money in the Bank,"Las Vegas, NV",1,84,84,Cashed in his Money in the Bank contract and the title's name reverted to WWE Championship. The brand extension returned and the title became exclusive to the SmackDown brand following the 2016 WWE Draft. The WWE Universal Championship was created for the Raw brand; the WWE Championship was then renamed to WWE World Championship.
128,AJ Styles,"September 11, 2016",Backlash,"Richmond, VA",1,140,140,"In December 2016, the title's name reverted to WWE Championship.[8]"
129,John Cena,"January 29, 2017",Royal Rumble,"San Antonio, TX",13,14,14,
130,Bray Wyatt,"February 12, 2017",Elimination Chamber,"Phoenix, AZ",1,49,49,"This was an Elimination Chamber match also involving AJ Styles, Baron Corbin, Dean Ambrose, and The Miz."
131,Randy Orton,"April 2, 2017",WrestleMania 33,"Orlando, FL",9,49,49,
132,Jinder Mahal,"May 21, 2017",Backlash,"Rosemont, IL",1,170,170,
133,AJ Styles,"November 7, 2017",SmackDown,"Manchester, England",2,371,371,
134,Daniel Bryan,"November 13, 2018",SmackDown,"St. Louis, MO",4,145,144,
135,Kofi Kingston,"April 7, 2019",WrestleMania 35,"East Rutherford, NJ",1,180,180,
136,Brock Lesnar,"October 4, 2019",SmackDown's 20th Anniversary,"Los Angeles, CA",5,173,184,"On the November 1, 2019 episode of SmackDown, Lesnar quit SmackDown and went to Raw, taking the title with him.
WWE recognizes this reign as ending on April 5, 2020, when the match aired on tape delay."
137,Drew McIntyre,"March 25, 2020","WrestleMania 36
Part 2","Orlando, FL",1,214,203,"WrestleMania was taped on March 25 and 26,[192] but McIntyre confirmed in his memoir, A Chosen Destiny: My Story, that the WWE Championship match was taped on March 25.[193]
WWE recognizes this reign as beginning on April 5, 2020, when the match aired on tape delay."
138,Randy Orton,"October 25, 2020",Hell in a Cell,"Orlando, FL",10,22,22,This was a Hell in a Cell match.
139,Drew McIntyre,"November 16, 2020",Raw,"Orlando, FL",2,97,97,This was a no disqualification and no countout match.
140,The Miz,"February 21, 2021",Elimination Chamber,"St. Petersburg, FL",2,8,8,Cashed in his Money in the Bank contract.
141,Bobby Lashley,"March 1, 2021",Raw,"St. Petersburg, FL",1,196,196,This was a lumberjack match.
142,Big E,"September 13, 2021",Raw,"Boston, MA",1,19+,19+,"Cashed in his Money in the Bank contract.
Big E transferred from SmackDown to Raw upon winning the title."